{"$defs":{"CausalDigest":{"pattern":"^[0-9a-f]{64}$","type":"string"},"ContentID":{"pattern":"^[0-9a-f]{64}$","type":"string"},"bounded_utf8_registry_string":{"maxLength":128,"minLength":1,"type":"string"},"bounded_utf8_registry_string_256":{"maxLength":256,"minLength":1,"type":"string"},"i128s":{"pattern":"^(0|-?[1-9][0-9]*)$","type":"string"},"rfc3339_full_date":{"pattern":"^[0-9]{4}-[0-9]{2}-[0-9]{2}$","type":"string"},"rfc3339_ns_utc":{"pattern":"^[0-9]{4}-[0-9]{2}-[0-9]{2}T[0-9]{2}:[0-9]{2}:[0-9]{2}\\.[0-9]{9}Z$","type":"string"},"safe_relative_path":{"pattern":"^(?![A-Za-z]:)(?!/)(?!\\.{1,2}(?:/|$))(?!.*(?:/\\.{1,2})(?:/|$))(?!.*//)[^/\\\\:\\x00]+(?:/[^/\\\\:\\x00]+)*$","type":"string"},"sha256":{"pattern":"^[0-9a-f]{64}$","type":"string"},"sq18s":{"pattern":"^(0|-?[1-9][0-9]*)$","type":"string"},"u64s":{"pattern":"^(0|[1-9][0-9]*)$","type":"string"},"uints":{"pattern":"^(0|[1-9][0-9]*)$","type":"string"},"uq18s":{"pattern":"^(0|[1-9][0-9]*)$","type":"string"}},"$id":"urn:build-finance:contract:risk-decision:v1","$schema":"https://json-schema.org/draft/2020-12/schema","additionalProperties":false,"properties":{"approved_base_atoms":{"$ref":"#/$defs/u64s"},"approved_notional_quote_atoms":{"$ref":"#/$defs/u64s"},"baseline_action":{"enum":["HOLD","ENTER_LONG","EXIT_LONG"]},"baseline_id":{"enum":["ALWAYS_HOLD_V1","MEAN_REVERSION_V1","BREAKOUT_V1","MOMENTUM_V1","TREND_V1",null]},"config_admission_receipt_id":{"$ref":"#/$defs/ContentID"},"decision_sequence":{"$ref":"#/$defs/u64s"},"effective_action":{"enum":["HOLD","ENTER_LONG","EXIT_LONG"]},"feature_snapshot_id":{"$ref":"#/$defs/ContentID"},"fused_action":{"enum":["HOLD","ENTER_LONG","EXIT_LONG"]},"market_id":{"$ref":"#/$defs/bounded_utf8_registry_string"},"measures":{"additionalProperties":false,"properties":{"concentration_bps":{"anyOf":[{"maximum":2147483647,"minimum":0,"type":"integer"},{"type":"null"}]},"drawdown_bps":{"anyOf":[{"maximum":2147483647,"minimum":0,"type":"integer"},{"type":"null"}]},"impact_bps":{"anyOf":[{"maximum":2147483647,"minimum":0,"type":"integer"},{"type":"null"}]},"participation_bps":{"anyOf":[{"maximum":2147483647,"minimum":0,"type":"integer"},{"type":"null"}]},"projected_equity_quote_atoms":{"anyOf":[{"$ref":"#/$defs/u64s"},{"type":"null"}]},"projected_market_value_quote_atoms":{"anyOf":[{"$ref":"#/$defs/u64s"},{"type":"null"}]},"session_pnl_quote_atoms":{"anyOf":[{"$ref":"#/$defs/i128s"},{"type":"null"}]},"stale_age_ns":{"anyOf":[{"$ref":"#/$defs/u64s"},{"type":"null"}]}},"required":["participation_bps","impact_bps","concentration_bps","drawdown_bps","projected_market_value_quote_atoms","projected_equity_quote_atoms","session_pnl_quote_atoms","stale_age_ns"],"type":"object"},"model_signal_id":{"anyOf":[{"$ref":"#/$defs/ContentID"},{"type":"null"}]},"model_signal_status":{"enum":["ABSENT","ACCEPTED","REJECTED","EXPIRED","DRIFT_DISABLED"]},"model_validation_receipt_id":{"anyOf":[{"$ref":"#/$defs/ContentID"},{"type":"null"}]},"portfolio_state_before_id":{"$ref":"#/$defs/ContentID"},"reason_codes":{"items":{"enum":["RISK_CONFIG_MISSING","RISK_CONFIG_INVALID","RISK_SEQUENCE_INVALID","RISK_STATE_UNRECONCILED","RISK_KILL_LATCHED","RISK_SESSION_CLOSED","RISK_EVENT_STALE","RISK_DECIMALS_MISMATCH","RISK_ARITHMETIC_RANGE","RISK_NONPOSITIVE_EQUITY","RISK_SESSION_LOSS","RISK_DRAWDOWN","RISK_STOP_MISSING","RISK_INSUFFICIENT_BALANCE","RISK_RESERVATION_CONFLICT","RISK_INTENT_PENDING","RISK_MIN_NOTIONAL","RISK_MAX_NOTIONAL","RISK_PARTICIPATION","RISK_IMPACT","RISK_CONCENTRATION","RISK_NO_ACTION","RISK_RUN_END_EXIT","RISK_KILL_EXIT","RISK_STOP_TRIGGERED","RISK_TAKE_TRIGGERED"]},"maxItems":26,"type":"array","uniqueItems":true},"reference_price_q18":{"anyOf":[{"$ref":"#/$defs/sq18s"},{"type":"null"}]},"replay_clock_ns":{"$ref":"#/$defs/u64s"},"requested_base_atoms":{"$ref":"#/$defs/u64s"},"requested_notional_quote_atoms":{"$ref":"#/$defs/u64s"},"reservation_id":{"anyOf":[{"$ref":"#/$defs/ContentID"},{"type":"null"}]},"reserved_base_atoms":{"$ref":"#/$defs/u64s"},"reserved_quote_atoms":{"$ref":"#/$defs/u64s"},"risk_decision_id":{"$ref":"#/$defs/ContentID"},"schema":{"const":"trading.risk-decision/v1"},"stop_price_q18":{"anyOf":[{"$ref":"#/$defs/sq18s"},{"type":"null"}]},"take_price_q18":{"anyOf":[{"$ref":"#/$defs/sq18s"},{"type":"null"}]},"validated_config_sha256":{"anyOf":[{"$ref":"#/$defs/ContentID"},{"type":"null"}]},"verdict":{"enum":["APPROVE","REJECT","KILL"]}},"required":["schema","risk_decision_id","decision_sequence","replay_clock_ns","feature_snapshot_id","config_admission_receipt_id","validated_config_sha256","portfolio_state_before_id","model_signal_status","model_signal_id","model_validation_receipt_id","baseline_id","baseline_action","fused_action","effective_action","market_id","verdict","reason_codes","reference_price_q18","requested_base_atoms","approved_base_atoms","requested_notional_quote_atoms","approved_notional_quote_atoms","measures","stop_price_q18","take_price_q18","reservation_id","reserved_quote_atoms","reserved_base_atoms"],"type":"object","x-contract-schema":"trading.risk-decision/v1"}
