{
  "schema": "trading.risk-decision/v1",
  "risk_decision_id": "7356690589b6862b233320b01cf3e49fe5d20facfb42ac17126b570441bb7f66",
  "decision_sequence": "1",
  "replay_clock_ns": "0",
  "feature_snapshot_id": "338c961a3031ed7884f23848e34515510683a9646cf07a28f185cde613b49b39",
  "config_admission_receipt_id": "bd92cef509e7a0f5804e1ce6559ab7276f6701b65bf17e042c8ab326a6fca4fe",
  "validated_config_sha256": "457cd0d75b6d9d86b967a4cce655960112c96cc57008feb09e6d9bd090af31d3",
  "portfolio_state_before_id": "cccccccccccccccccccccccccccccccccccccccccccccccccccccccccccccccc",
  "model_signal_status": "ABSENT",
  "model_signal_id": null,
  "model_validation_receipt_id": null,
  "baseline_id": "MOMENTUM_V1",
  "baseline_action": "ENTER_LONG",
  "fused_action": "ENTER_LONG",
  "effective_action": "ENTER_LONG",
  "market_id": "fixture-base-mint/fixture-quote-mint:jupiter",
  "verdict": "APPROVE",
  "reason_codes": [],
  "reference_price_q18": "1000000000000000000",
  "requested_base_atoms": "100000000",
  "approved_base_atoms": "100000000",
  "requested_notional_quote_atoms": "100000",
  "approved_notional_quote_atoms": "100000",
  "measures": {
    "participation_bps": 200,
    "impact_bps": 25,
    "concentration_bps": 1000,
    "drawdown_bps": 0,
    "projected_market_value_quote_atoms": "100000",
    "projected_equity_quote_atoms": "1000000",
    "session_pnl_quote_atoms": "0",
    "stale_age_ns": "0"
  },
  "stop_price_q18": "950000000000000000",
  "take_price_q18": "1100000000000000000",
  "reservation_id": "aa45ab6ba9fc96f80424241163aaa1a43b6388500684063910381d57bdb6c6f6",
  "reserved_quote_atoms": "101000",
  "reserved_base_atoms": "0"
}
